1921	1511119360378683395	E eu com vergonha alheia. Alguém tem que parar isso, estou depressivo o tempo todo, meu coração não está normal faz tempo. Eu vou infartar, mas se der para voltar, vou assombrar uns carinhas 23 horas e 59 min. e 59 seg. por dia, com 1 segundo de descanso que ninguém é de ferro. 	1
1442	1511034553166667784	vocês dando mídia pra um tarado é o cúmulo na moral 🤢 	1
749	1511045747814371332	3. Biden pediu um julgamento por crimes de guerra contra Putin, dizendo que foi injustamente criticado quando, em março, se referiu ao presidente russo como um criminoso de guerra: 	1
858	1511118616955076608	ou seja, gosto de exclusividade e tenho pavor de quem tem algo igual ou parecido com o que eu tenho. Começando por ai o drama de uma “nao blogueira” 	0
1803	1511045759336165379	Eu sei o quão sortuda sou e por isso amo meu paizinho em segredo aqui nesta rede onde todos são juízes. 	0
3576	1511118055761403908	O tal do homem é um ser muito emocionado né gente n pode ver uma vergonha que quer passar 	0
4063	1511038735978307584	minha bebê lau n tem paz mesmo, ela não tem liberdade, nada 	1
3621	1511123168882311168	primeiro dia de aula e o prof mete um trabalho em grupo gente q isso n sei n 	0
844	1511045807574822916	Um dia ainda estou pra perceber porque é que um rapaz que simplesmente deu a sua opinião, gerou tanta revolta. Eu também não concordo com aquilo que toda a gente está a discordar, mas calma é só a opinião do rapaz 🤷🏽‍♂️ 	0
833	1511042116927082496	Venho do futuro dizer, mbappe fica no psg, pois o emiraraberico prometeu o PAI 	0
2927	1511114412299538434	mulher sabe muito das coisa memo fui fala ca minha ex do celular do meu amigo ela ja atendeu com 'oi amor' achoq ela me quer de volta 	0
1614	1511031852391358479	Calor do caralho, pneu furou, tudo errado hoje 	0
3356	1511117581771497472	Quando eu falo que não entendo esse “empoderamento” absurdamente sexualizado da Anitta… surtam! Mas tá aí 	1
213	1407891878863900000	Queria estar fazendo qualquer atividade física para me aliviar e tirar esses pensamentos ruins da minha cabeça!	1
2520	1511122672213704712	e percebi q meu eixo de amizade / elo é 70% ariano  nunca critiquei (nunca mesmo 	0
1130	1408043967506170000	Espero q seja um surpresa boa rs❗	0
131	1511045216555479051	O surto meu pai 	0
3087	1511042019623374858	tenho medo de ler coisas q machucam 	0
439	1511121779963703296	Correção, ***Lei 14.026*** 	0
4505	1511044824442589186	Fato, um bando de Nutellas lacradores sensíveis.!!! 	0
4457	1511118089613627394	E mongo da tesla que comprou as ações do Twitter Daqui a pouco isso aqui vira plataforma de neoliberal igual Instagram 	0
2421	1511117569486467076	O Fábio Vieira joga muito. Agora façam o que quiserem com esta informação. 	0
2524	1511114494692544512	Errado ele não tá. 	0
3467	1511122316746440705	Tem que ter respeito,Deus primeiro,mulheres,crianças depois os guerreiros 	0
2952	1511030612534214667	já disse e repito, quero #AsItWas morando no Top 50 Global 	0
1609	1511034765373321224	Eu nao sei da onde veio tanta essa vontade de namorar e dar certo, casar e viver o resto da vida juntos. 	0
853	1511030897470062596	é muito estranho morar sozinha pq eu sei o conceito e as receitas dos pratos mas e o medo na hora de fazer e dar tudo errado é brabo 	0
448	1511036656169762826	Ele fumou um cigarro, já o teu fav completou a cartela de crimes, por isso estão com a ficha criminal com 10 páginas 	1
4277	1407769456076590000	a criança vai descobrir primeiro que o pai	0
4008	1407870562320400000	autoavaliação: quanto tu é de 0 a 10? inseguro: 5 vingativo: 4 carinhoso: 7 grosso: 4 sensível: 8 ciumento: 2 estressado: 8 encaminhar para o psiquiatra	0
2177	1511118191099105283	Esqueçam totalmente o que eu falei, era só os filtros do insta deixando ela com essa aparência kkkkkk Obs: pqp minha bunda é muito linda vai tomar no cu ;-; 	0
4037	1511115340050493443	sim pois eu sou linda e ela é feia 	0
1727	1511033661843460103	No livro “Mulheres que amam homens violentos” o autor frisa a importância que o abusador dar ao sexo pós violência, para eles mesmo que inconsciente é trazer essa mulher novamente para o seu domínio de abusos. Para a vítima eu nem preciso descrever como ela se sente... 	1
103	1407846591243890000	Cara, não fazer o terceiro gol contra o Cuiabá é mais do que vergonhoso.	0
4152	1511041810084380679	Vê minha mãe chorar acaba com meu dia 	0
3132	1511119108904992768	Ela entra em uma porta eu quero sair na outra. Passa perto de mim eu me sinto mal. Deus me livre preciso me curar isso 	0
2832	1511116728125861894	Não errei nada ou ela não olhou direito? 	0
523	1511120169032196099	não trair eh o básico, mas amiga vc trai(???) 	1
3017	1511122981099126785	que ódio, faz de tudo pela pessoa e ela não enxerga, é muita sacanagem mesmo 	0
1102	1511030625180045313	comendo e me culpando, não vai dar certo 	1
1821	1511039752350453768	mano um trabalho complicadíssimo pra amanhã e ngm sabe como faz esse é meu grupo da facul 	0
1415	1511119916677668867	Tá com medo de perder o dinheiro das doações ? É cada uma 	0
165	1511028805296656392	tudo indica q o amor da minha vida sou eu mesmo 	1
3	1511046128145477639	Eu to num estado... q só sei rezar, rezar ..rezar 	1
3308	1511115157602242564	meu coração até errou as batidas caras 	0
907	1407886222320700000	agr traz arrependimento	0
2662	1511030165626839041	Eu dizer que 'latiu'. Mas, seria uma ofensa aos doguinhos que tanto amo e respeito. 	1
2397	1511031000037474308	Vc é sujo, traiu seu povo! Vc merece todo o desprezo do mundo, seu verme repugnante! 	1
4140	1511041025959149573	Só poderia ser mulambo 	0
3542	1511032371029725201	mensagem apagada que não apaga de verdade foto de visualização única que dá pra tirar print e agora isso esse Zuckerberg não acerta uma 	0
2419	1511036369661005829	Fiel a mim, é leal a quem eu amo 🤞❤🕊 	1
3189	1511115016262631435	To sentindo uma dor insuportável, Deus me livre 	0
1860	1511028147998932999	1 ano e 10 meses da dona de todo o meu amor 🥺❤️ O tempo está passando muito rápido. 	0
3718	1511121690738188290	mas ultimamente ando tendo tempo pra nada, então quando to livre vejo dorama ou leio ou vejo skz pq né 	0
3324	1511043866568409093	tenho ganda respeito por pessoas que conseguem tirar boas fts nas discotecas!! 	0
2555	1511122269367582721	Eu mandando o meu look da lust pros meus amigos como se n tivesse postado nos melhores amigos 	0
3383	1511118829115617295	eu tô com tanto nojo dessa grt 	1
1741	1511118551159119879	fatos inúteis sobre mim • nome: brunao  • sexo: gosto  • aniversário: 4/20 • signo: so nao virgem! • gostando de alguém: das minha cachorra 🤬 • fixados no tt: ? • altura: 18cm • autoestima: 🤫 • comida fav: strogonoff de frango 	0
2499	1511030922661048322	Que bom que não doeu 🥺 	0
395	1511030185059094535	queria morar no abraço dele 	1
625	1511033830857220101	eu só passo vergonha pqp eu devia ter filtro 	1
695	1407448058732970000	Juliette pode voltar a ter só 3 k de seguidores q eu vou tá apoiando e engajando tudo q ela faz. Pq ela é maravilhosa, o resto o q tenho a ver	1
947	1407866956384980000	eu me amo de cabelo curto e não tem jeito	1
761	1511115095774056450	espero que esse mês tudo dê certo… 	0
3430	1511039122319843334	faltam MESES pra começar a faculdade e a minha mãe tá falando pra eu separar roupa e combinação pois segundo ela não quer me ver igual mendiga 	0
2739	1511028016935227398	Declaração de amor é isso aq kkkkk 	0
2311	1511033156845060098	[4/4 14:11]: ele gostou desta [4/4 14:20]: Vocês são os melhores receber esse tipo de feedback é muito bom. é sinal que estou no caminho certo 	0
1383	1511039212287635458	Enzo foi de van pra escola hoje, meu coração quase saiu pela boca 😫😫 e ele nem aí, nem olhou pra trás direito... 	0
2228	1511032876707553288	Tô linda de cabelo curto não vou mais deixar crescer (ssa opinião de auto destruirá em 8h) 	0
1443	1511032884794118144	Nossa, Vou mandar pra el 	0
2894	1511038954631487490	O FATO QUE EU VI TODASSSS 	0
2831	1511121664762953728	meus amigos tem duas opções, me dá um ovo de Páscoa de presente, ou me dá um presente 	0
1401	1511042670612955142	coração da mãe é grande só não cabe sentimento 	0
645	1511040562740310021	bobeira boba esses meus amigos falando querem começar a namorjaksjsjse 	0
4359	1511116065048342529	Li pela primeira vez um livro onde os personagens são bailarinos e amei demais. Filmes de dança sempre foram meu xodózinho, agora quero livrinhos tbm. 	0
4109	1511116404757614592	queria carinho 	0
4464	1511044683140681740	Privilégio é poder escolher como você usa seu tempo! 💞 	0
1882	1511118736954175488	Será que no futuro as crianças vão falar 'Cala boca, teu pai via filme de herói'? 	0
771	1511037129220055044	Medo de comprar essas roupa na shein é chegar aqui eu ficar igual uma safada 	1
4296	1511122432337317889	amo meus amigos que entendem que sou uma péssima amiga e é isso aí 	1
51	1511114287686856704	Moro vc não é melhor pessoa para falar em posicionamento...não acha.. 	1
2598	1511121014897446914	+++ » vontade de comer de tudo sem conseguir comer nada direito, sono toda hora, dor de cabeça permanente, perda de peso...) É, tô realmente super bem. 	0
2541	1511029995866492929	É assim que se demonstra amor 	0
2649	1407872584675470000	Que ódio de quem vai fritar algo e não espera o óleo esquentar	0
2822	1511037881745297411	faz 2 dias q eu n joguei vôlei e tá parecendo 2 semanas 	0
3897	1511032601347334147	eu fico todo negoçado qnd alg mt bnt me da moral 	0
1375	1511033905641660421	Vivi pra ver Duda chamando meu pai de Gaymer hahahahaha mariana só ensina merda p essa garota 	0
1121	1511038453936500746	se eu for ficar pensando em todas as oportunidades que eu perdi e perco por não ser filha de milionários, minha vida passa e eu continuo reclamando sem sair do lugar obviamente desigualdade precisa ser levada em conta, mas parar a vida pra lamentar não ser podre de rico é bucha 	1
4324	1511033706848342017	q vontade de comer mc’donalds puta merda 	0
3041	1511121765875003394	E isso aqui meu Deus? A atriz q interpretou Madame Yu mostrou um grupo onde TODOS os atores de T.U estão. O Yibo e o Zhan estão nesse grupo, então significa q eles ainda mantém contato?! Eu amo essas migalhas. 	0
1035	1408061145655640000	a bixinha ta tao magrinha q inveja	1
2451	1511118450495741957	vsf que merda 	0
2286	1511115224778215425	me fala seu time e eu digo se te abraço ou te chuto kibei da tml 	0
2145	1511041988786892810	Eu só acredito vendo. E vendo, não acredito! PUTA QUE PARIU! 	0
2827	1511114936017211396	Muito bom 	0
1250	1511043207089565704	Kazuha na 2.8 naooooooo AGR não vou poder pegar a Yelan na 2.7 meu deus sempre fui triste depressivo beirando o suic* 	0
111	1511122229609775121	no meu governo esse aqui vai ser preso logo no início 	1
3268	1511029143110139918	pensando eu qd tivwr 40 vou mt ser aql tiozao inconveniente q faz piada na hr errada 	0
183	1511028624312479745	Tudo vai dar certo 	0
2517	1511122927227486218	Esses cara não me causa chama, não é pelo nome dela que tu chama E quando se deita na tua cama, eu sei que lembra de mim Tu tem meu coração e a sorte de me ter E tem minha companhia bem além do prazer 🎶 	1
3316	1511042825370095618	olha o poder da gata nem foi na premiação e mesmo assim a dra. taylor swift entre os assuntos mais comentado 	0
613	1407757596862390000	Mainha viajou e agora vou ter q ficar vendo os storys do povo comendo as comidinhas de milho e ficar na vontade 🥺	0
3773	1511120597794930699	tentativas em vão tentar tirar vc do coração igual querer viver sem respirar é como querer apagar a chama de um vulcão  hino. 	0
3889	1511037925462577168	Chorando igual uma grande idiota 🤡 	0
1706	1511045933710016512	os preços caríssimos realmente o trabalhador brasileiro ta preocupado com fascista europeu morrendo kkkkkkk esse políticos vagabundos eh mole? 	1
1557	1511040173747978247	Ouvindo um podcast aqui com uma história de um menino que tinha esquecido o carregador na casa de uma amiga que morava muito longe e ai a solução dele foi... atenção: entrar num aplicativo de relacionamento, falar com uma pessoa que mora perto e usar o carregador dela. 	0
4437	1511119989167861764	Deixei shampoo cair em meu zóio, agora tô com dor e sem e enxergar direito, ou burrice meu pai 	0
1711	1511116980392189953	cansei de tentar fazer nossa relação dar certo. 	0
1178	1511028692566355968	Talvez nos encontramos na hora errada, eu a pensar em amor, tu em madrugada e agora não conseguimos dizer nada além de adeus. Talvez nos perdemos pelo caminho mesmo do teu lado, me sinto sozinha. Melhor eu ir, xau! Melhor pra mim!😪💔 	1
2129	1407769920876720000	Quando tu descobrir a história eu assumo ele KAKAKAAKAKAKAKAK	0
2532	1511036886118240261	👏👏👏👏👏👏 estamos todos torcendo e com certeza chegarás a vitória 	0
397	1511038230078140417	Eu dormi mal hoje e já tô toda dolorida, e ainda tava inventando de jogar vôlei de areia... no outro dia eu não vou ANDAR 	0
1291	1511117740244832260	Criando força pra ir pra acad, mas meu corpo voltou a ficar uma bosta 	0
3458	1511032821762121744	aquém tá mais errado, quem traiu, ou quem deixou abandonado? 	1
1630	1511039244537638915	Até dentro da própria panelinha da faculdade tá gerando muido fazer esses trabalhos em grupo 	0
3096	1511045578930667520	o meu: 	0
2993	1407867049829970000	Amo o tal da comida simples, pqp 😋	0
4146	1511121264982769667	Meu Deus! 	0
1289	1511121644223410182	Miliciano perde pra qualquer um. Até pro juiz ladrão e corrupto. 	0
3858	1511114569414062086	Está aí uma notícia que não estava esperando! Cuidado com o Macaco de Três Cabeças! 	0
3412	1511044929774043139	fumei 4 so tava com medo da mae sair do quarto antes 	0
1743	1407894821646240000	Impressionante! Que surpresa!	0
2136	1511116291217793024	Não insista em ser prioridade de quem sequer lhe oferece consideração, mendigar amor é fortalecer o desprezo de quem lhe despreza. 	0
2086	1511045381995610113	Sonho 	0
3641	1511119087409192960	Faça sua parte. A presidência do Senado e do Congresso é 1 vergonha 	1
3720	1511122175356461060	acho q falta alguma coisa na heloyza deve ser uma aliança cof cof 	0
571	1511114404833734657	Saudades da época em que se podia chamar: Viado de viado; Puta de puta; Corno de corno; Gordo de gordo; Travesti de travesti; Fdp de fdp... E estava tudo bem. Agora temos os cornos militontos para ficar cagando regras do politicamente correto, vsf! 	0
4514	1511122588877078546	nunca tive uma conversa tão boa com a minha mãe igual tive agora 	0
4253	1511115550721724421	É desse jeito..... 	0
3829	1511028244501479427	Sdds do seu carinho 	0
2982	1511038619519262721	o apelido que as minhas amigas deram para ele é só a melhor cena HJAHAJHSSJBSJSBSH 	0
3366	1511043204065509377	o dia que eu sai pra caminhar com a camisa do Brasil e uma mulher gritou fora bolsonaro pra mim 	0
2309	1511045381903339525	Diz o roto ao nu… 	0
3338	1407869207065280000	Só quero viver um romance que não destrua meu emocional	1
4308	1511028213820137472	amor, nunca é tarde para começar uma academia! iniciar logo sua rotina de treinos, se não num espaço próprio então até mesmo em seu quarto, por vídeos no youtube! te prometo que é recompensador o corpo que você vai ter, um igual aos de thinspos que te incentivam tanto ! (^ω~) 	0
4318	1511042730973188099	Que falta de respeito, gente. Esse povo é muito ridículo!!! 	0
1534	1511045311610953732	E ela terminou a consulta falando: “meus pais morreram no mesmo dia com 2 horas de diferença, pois após minha mãe partir meu pai não suportou e sofreu um AVC”… pronto gente ai acabou cmg 	0
4304	1511033139057020938	foi inocentado, mas nem quando era só suspeita o auê não foi tão grande hahah 	1
2647	1511115149339512840	Vô faze 	0
1874	1511115753860259840	É o maior técnico da história da Sociedade Esportiva Palmeiras 	0
356	1511030428383293450	pessoas que são do passado devem ficar no passado, certo? Mas por que eles estão sempre em minha mente e me lembro de tudo que fiz para eles? 	0
608	1511119499549986818	o valtor top melhores vilões de winx só perde pros bruxos da quarta temporada que eram o terror da winx 	0
2742	1511028789773582349	Melhor mesmo continuar de focinheira, pra ver se o povo esquece sua cara de pau. Ou talvez tenha feito plástica no cofigo de barra da focinha, às nossas custas e esteja escondendo com esse pano sujo. Cuidado com a infeção. 	1
239	1407870098522710000	Posso me apaixonar de novo? Pois pronto!! Pitica 🥰🤏❤️	1
3271	1511117227008872449	Passei a minha infância e adolescência inteira tendo que aceitar certas coisas e ter que ficar quieta por pensar que eles só “querem o meu bem”, mas com o passar do tempo parei de ser otaria e eu só respeito quem me respeita 	0
4446	1511044739306508294	Meu ex vivia me chamando de mãe, também tinha que ficar educando como se fosse meu filho 🥱🥱🥱 	0
282	1511113952218038276	esses bolsonaros são canalhas covardes, feito esse deputado frouxo  que ataca STF e depois vacila,nessa apologia a tortura e incentivo a violência típica de fascistas no poder, valentões provocadores terão que se encontrar com a justiça no fim da mamata... 	1
2167	1511116783297703936	É tudo no tempo certo 🙌🏻 	0
3997	1407872533060270000	Cringe com orgulho	0
3747	1511032295565799438	minha mãe com papo de i doser kkkkk mal sabe ela que eu sou da época que a gente pesquisava onda de lsd no youtube e ficava vendo umas imagens nada a ver que deixava tudo se mexendo e achava que tava drogado, três crianças com 10/11 anos achando que tava drogadão kkkkkkkkk 	0
3437	1511037638828077064	*Tweet para todos aqueles q se dizem meus amigos*  Queridos amigos, informo vocês que a partir de hoje (04/04) vocês tem exatamente 1 mês e 24 dias para planejarem minha festa surpresa, e é a obrigação de vocês saberem a data do meu aniversário, obrigada, amo vocês. 😘 	0
1814	1511118320803758080	e eu que tenho um pai que fabrica sorvetes 	0
2799	1511118356316839940	RONALDO GORDÃO,ROUBOU MEU CORAÇÃO 	1
3888	1408071972081350000	Parabéns Bia Kicis ...	0
374	1511029118627942403	Ai mano que amor 🥺 	1
3525	1511045566586707969	Pensando aqui que NINGUÉM cozinha igual a minha mãe que saudades de uma comidinha feita por ela 😭 	0
4396	1511118987349970950	E dizer que esse cidadão era um JUIZ FEDERAL. Seus ex-colegas devem estar pasmos com o comportamento desse indivíduo. 	1
3115	1511036682669375492	sistema do Detran fodido nojento corrupto desgraçado feio infeliz 	1
1937	1511046316465561600	Eu tô virando um cara focado, brincalhão porém sério nas horas certas, disciplinado e homão da porra, graças ao Paulo muzzy A melhor coisa que que fiz da minha vida foi acompanhar esse cara e todo dia ver live dele 	1
1321	1511032667806052359	Fico mais indignado com a mulher dando moral pra isso. É outra filha da puta 	0
1125	1511117073082109952	esse vídeo é muito bom pqp !!! kskskskskskskks 	0
2511	1511032147775311873	ela só tá reforçando uma sexualiação no brasil que já existe há ANOS e na cabeça de alguns gringos, o brasileiro só serve pra sexo e nada mais 	1
1527	1511121317092904964	Se trata de uma liberdade seletiva? Quem não queria usar, era chamado de negacionista 🤷‍♂️ 	1
3687	1511032693412220928	Se eles soubessem de toda a verdade, ia dar uma merda gigante 	0
3206	1511029659345072131	Hoje é dia dele... que me faz passar raiva, que me faz chorar de alegria e de tristeza, que me faz gastar todo meu dinheiro, que enche meu coração com um amor que nem sabia que poderia sentir! FELIZ DIA INTERNACIONAL, 113 anos e eu te amo e te odeio na mesma intensidade ❤️ 	0
4030	1511034351898738694	fé que vai da certo e daqui um mês estarei bem plena😅 	0
729	1511114132485025800	eu sabia que eu tava certo. odeio minha intuição fodidamente certa 	0
2458	1511117234801889287	sabia que tinha algo errado com a minha fav 	0
2495	1511122326733168644	que ódio não poder pedir a suyoung em casamento porque a coreia é homofóbica ela é tão louca das ideias que nem eu que eu sei que ela ia topar eu só quero cidadania em qualquer outro país 	1
1391	1511115525870473222	assim de saúde: 	0
4285	1511115241932873731	Adolescente tem mais é que fazer merda mesmo pra aprender, você que já passou dos 30 é que tá errado fie 	0
1408	1511032347507970054	espero que minha intuição esteja errada 	0
3272	1511122180813246467	O golpista frouxos apareceu, estava ocupado tramando contra o povo brasileiro! #SemipresidencialismoNao 	1
3137	1511116737600708613	Comi 2 fatia de pizza já fiquei enjoado... 	0
4323	1511043965872750595	medo da minha calça não chegar até meu aniversário 	0
3239	1511119395950628873	Aí ainda tem gente que fala que eu não tenho direito de odiar o Pitico pelo resto da minha vida, olha as coisas que eu tenho que ficar lendo por causa dele 	0
2915	1408052498401730000	Que Deus me livre da falsidade e da inveja	1
3344	1511044215035379713	e minha mãe que disse que quer assistir bridgerton kkkkkkkkkkkkkkkkkkk help 	0
2264	1511032118406787082	vou falar a vdd adorei a nova do bigbang n faz nem de longe meu estilo de música mas achei extremamente linda.... o top tava mto lindo tb benzadeus a yg finalmente pagando os milhões de pecados cometidos nessa terra e fazendo pela primeira vez na história dois cbs 'bons' seguidos 	1
382	1511045318376312849	eu esqueci q tem todo um processo pra poder entrar no banco 	0
4096	1511029218209058830	Quem desrespeitou vc amiga? 	1
4443	1511045888134766593	preciso de força pra não chegar lá e pedir pra vim embora 	0
3925	1511043724859613185	ou nao ter que pedir a ninguém para me levar aos jogos e não ir sozinha de noite para casa depois dos treinos 	0
2589	1511118896912375814	que nojento parece q nao ve uma ducha ha semanas 	1
1502	1511038761664192520	😂👏👊😷😷🇧🇷🇵🇹💉💉 Bolsonaro é Corrupto Mentiroso Mentira Mata #ForaRodrigoPacheco #PachecoCONIVENTE #ForaCiroNogueira #CiroNogueiraCúmplice #ForaMoro #MoroNaCadeia #ForaBolsonaroRacista #VacinaSalva #ForaBolsonaroVagabundo #ForaArthurLira #ArthurLiraCúmplice #Lula13ÉaMelhorOpção 	1
3954	1511032047657267204	Bando de merda sem treinamento nenhum 	0
4249	1511121647704621059	Só tem meu respeito quem conhece essa 	0
1320	1511114626519363585	Que dor terrível 	0
4156	1511121080987045890	No Vasco tem que ser igual. 	0
1233	1511116353868111876	Sorria que eu estou te filmando Sorria o coração tá gravando O seu nome aqui dentro de mim Sorria que o prazer já vem vindo Sorria nosso amor tá tão lindo Não quero ver você tão triste assim 	1
2236	1511122100517486596	queria mto poder acreditar nisso 	0
3827	1511027707659833346	quando faço as vontadinhas todas, sou um amor, quando não as faço já sou a maior filha da puta! 	0
681	1511033072623489024	Vai dar merda 🥳🥳 	0
3809	1511043362958229517	Vejamos o lado positivo: vem mais dinheiro pra conta do pai 	0
1274	1511045866471178245	O respeito, o carinho, a consciência que sempre precisa tá amadurecendo junto, o senso de humor com tudo....Ele é um cara em meio milhão de caras por aí e digo com toda certeza dos meus 30 anos de vida de quem já conheceu todo tipo de homem. 	0
2789	1511121777933627392	n sei nem pra que eu fui atras dw arranjar amizade com aquilo minha pior escolha 	0
2364	1511119079695863811	Eu tô com uma péssima mania de estacionar meu carro num lugar e dps vou p um lugar totalmente contrário procurar ele igual uma otária 	0
3286	1511116380099256320	Encontre alguém que te ame mais que eu amei Te desafio! 	0
3523	1511116154647064579	Amanhã a aula de estatística vai ser passada a ver o meu grande amor, caguei. 	0
123	1511119246847324163	ninguém se importa sua vagabunda cala a boca voce so fala merda ninguem te aguenta mais (autocrítica 	1
2634	1511043188416552963	dentista falando q meus dentes já estão bem alinhados e eu morrendo de medo de ficar feia sem aparelho 	0
2922	1511119182376624131	Jesus amado!!!! Que coisa louca!!! Ninguém tem o direito de fazer tal coisa. Desrespeito total! 	0
660	1511116923941097472	Tenho que começar a tratar o LinkedIn com o respeito que ele merece, entro uma vez a cada dois séculos kkkk 	0
1796	1511118125059788805	pqp que fedor de chulé nessa sala 	0
2579	1511116947957690373	As crianças de 10 anos com ciúmes de um cara com quase 30 anos, ainda mais ele não sabe nem da existência desse povo 	0
2303	1511031024171556870	Regra número 1°: Não demonstre amor, o amor vai te matar 	0
3102	1511028315376824324	Eu amei sua figurinha amor😂😂😂 cada dia uma coisa pior sua em amada 	0
2710	1511039927340908545	Macron que agradeça ao céus pela eleição francesa já ser no próximo dia 10. A candidatura murchando igual pneu 	1
1960	1511037335785426957	pelo menos falou bonito 	0
4237	1511122787733278728	Amizade linda ❤️❤️❤️❤️ 	0
230	1511036604596506632	nao tem jeito nct simplesmente o grupo que mais obteve o gotejo em toda historia do universo 🚫🧢 	0
901	1511122355204112384	o medo que eu tenho de conversar com as pessoas aqui e acabar esbarrando com a mais doente do site 	1
3995	1511039220223291397	#SelecaoSportv Sobre o lance dos jogos do Palmeiras x São Paulo, constata-se que seu comentarista, Sr. Sandro não tem critério algum, além de ser imparcial. No primeiro jogo afirmou ser pênalti, no segundo que não. Além de dizer que houve falta do Danilo no segundo gol de ontem. 	0
765	1511042406073966597	nossa serio esse mlk me empurrou hj amanha eu vo chegar no colegio c uma faca 	1
4052	1511044684487049221	tudo isso por causa de um tapa bem dado no filho da mãe lá. 	1
4076	1511118711901593604	Esse Evandro joga com o nome. Nunca vi um jogo bom desse cara com a camisa do Vôlei Renata 	0
