2429	1511028024216543244	quero isto 	0
4045	1511030273034567682	vira essa boca pra lá pelo amor eu te implorooo tem gente que passa mal tem gente que morre mulher pelo amoooor 	0
2720	1511028660832251910	Tem esquerda xingando as alianças. A BOLHA! O GRUPO QUE REINVINDICA POSIÇÃO DE ESQUERDA, MAS XINGAM LULA, ALCKMIN E AS ALIANÇAS, SÃO COLABORADORES DOFASCISMO E VISAM SATISFAZER A BOLHA QUE LHES GARANTEM O 'STATUS QUO'. 	1
1617	1511120664253677568	Qual á graça de gravar às pessoas nós rolês é ficar mandando em grupo?!🤬 	0
4271	1511118781791277056	Não gosto da implicação de que de resto todo mundo tem que se sentir mal se tiver usando droga. Moralismo do caralho. 	1
3381	1511115944789262346	muita coisa dando errado na minha vida, e muita coisa dando certo ao msm tempo, e é sobre isso! nem sempre as coisas saem do jeito que agente quer. 	0
106	1511118753899155462	kkkkkkkkkkkkkkk só tem maluco 	0
2133	1511046274690265091	qual o seu medo, diz pra mim 	0
1226	1511122975096860675	Brás Cubas As almas penadas do incidente em em antares 	0
1039	1511028751995478020	mds que dor de cabeça, só queria um cafuné 	1
2522	1511029364703612932	a carinha do meu solzinho :( o grudinho aaaaaaa são eles 	0
3878	1511037955191840778	kkkkkkkkkkkkkk erro nunca 💪🏽😭 	0
3326	1407869837741890000	Que carência, queria um dengo 😒	0
513	1511119707239329800	Que Deus me guarde e me livre de toda maldade.🌏🎭 	1
1725	1511118863269871620	apronto fumar virou crime 	1
3140	1511122747853836289	Abriu uma oportunidade dentro a empresa, da vaga que antes eu estava tentando, mas vendo agora de dentro da empresa, não sei se me garanto, as amigas da equipe tavam falando pra eu me candidatar, mas não sei se realmente me sustento nessa.  Veio bem mais rápido do que eu esperava 	0
1678	1407881795526440000	ta c depressão mikaelle ss	0
1822	1511115175537041408	Esse tweet aí sobre namorar programador é claramente bait. Parem de doidos pelo amor de deus 	0
3015	1511120152229826561	Não tão satisfeito, sem legado, sem sonhos realizados, sem um grande impacto para a humanidade. Porém, deixarei o meu nome gravado no coração de um número restrito de pessoas, é satisfatório pra mim ? Não. Logo, sentiria-me um fracassado. 	0
633	1511038357274566659	..COM VIOLENCIA CRIMINOSA, AGITADORES LIGADOS AO PT DO LULA, ONGS, MST E MTST INVADEM SUPERMERCADO EXTRA EM SÃO PAULO. HÁ NOTICIAS DE INVSÕES COORDENADAS DE MERCADOS  EM TODO O PAIS.!  ..NÃO SERIA ISSO A AMEAÇA A DEMOCRACIA QUE LULOPETISTAS E MINISTROS DO STF E TSE DIZEM HAVER.!? 	1
2677	1511028501322903564	Amor eu sei que você quer o melhor de mim🎶 	0
3617	1511039343212875782	E ela não tinha esse direito! 😭😭😭😭 NOSSA, BICHO...... ✊✊😡😡 	0
1964	1511043196763181064	Caraio, os caras discutindo o tcc usando a vida dos outros por causa de uma simples foto KSKAKAKAKAKAKWKAKAKAKA da até medo de postar foto agora 	0
1339	1407866719218050000	Perdi minha tia a menos de 1 semana pra essa doença que assombra muitas e muitas pessoas/familias pelo mundo. E hoje perdemos um companheiro de RP também. Descanse em Paz N	0
3529	1511118222711562250	esses velhos safados indo tirar foto com o ronaldo, não tem um pingo de vergonha na cara né pqp 	0
3626	1511028350579527692	Mereceu apanhar fds, Sadado..! 	1
301	1511121363343454212	Passei anos em um relacionamento bosta e agora que tô sendo super mimada as vezes acho estranho. 	1
3837	1511115088991854592	bora,derruba isso 	0
4148	1511045649780858881	CRIAÇÃO DE VAGABUNDOS E BANDIDOS . . . 	1
1817	1511119237108142080	Fala dos outros mais faz igual incrível ,peguei ranço dele q eu nunca imaginei ter 	0
2642	1511116878151831560	nem pra inventar uma desculpa melhor essa mulher consegue plmds tome vergonha na cara 	0
3211	1511030850586087429	merece pica, isso sim 	0
1993	1511030421705965568	Tudo certo Modus, ainda tô tentando entender o episódio da semana passada!!! Essa pausa vai dar tempo para eu esclarecer 	0
310	1511120201349316617	É. Uma hora os cegos verão essa realidade. 	0
2235	1511115324690771968	uma vez me disseram uma coisa que eu nunca vou esquecer... ética, é o quê você faz quando todos estão te olhando.  moral, é o quê você faz enquanto ninguém te vê. 	0
1322	1511046174949711874	ela jurava que era baseado em fatos reais kkkkkjkk eu tô morrendo 	0
3673	1511039322903961608	Comparar sua propria vida c a do proximo é um erro que so pessoas inteligentes nao cometem. 	0
3117	1511120112081948680	ela roubou meu coração olha que nem tinha revólver 	0
4495	1511123295080525824	fui fazer piada no grupo da igreja e agr tão tds assim 😐😐😐com meu senso de humor mds- 	0
4114	1408036107158160000	Esse aqui foi um dos melhores dias da história do twitter	0
2564	1511029864937271296	Hoje que eu to c dor de cabeça, meu patrão e a dona Angela resolveram desabafar cmg, tá de brincadeira 	0
3915	1511114503987073027	dor de cabeça passa nunk credo 	0
1588	1511122741663084545	alguma mulher com cidadania em outro país para casar comigo eu serei uma ótima esposa lavo passo cozinho sou aberta para sugestões sexuais sei pintar montar móvel cuidar de jardim gosto de animais não gasto $ com coisas além de livros e minhas amigas falam que eu sou engraçada 	0
2342	1511113790611410956	Quem tem meu jeito carinhosa tem tudo 🥰 	1
1753	1511033970779115541	Já que insistiram em um paredão falso. Pra ninguém desconfiar o certo é ir o Gustavo. Porque o Arthur sair para o Eli não tem lógica! #bbb22 #paredaofalso #gustavonoparedaofalso 	0
1096	1511115717885714439	tirar cravos é afeto 	1
904	1511029633009041420	reclamei sobre o fim de semana mas amei cada pequeno detalhe dos dois dias 	0
642	1511116018059460609	to tão pilhada de nervoso, um misto de se vai dar certo, será que consigo morar sozinha sem dividir moradia, ou se ainda sim melhor esperar, e nem sei se vai dar certo aaa 	0
4116	1511037089210585095	em plena segunda-feira minhas amigas me levando p McDonald's. já sou gg aí comendo isso logo no começo da semana piora mais.  adoro 	0
3805	1511042888892882946	Você e muito eficiente, conclui rápido demais o trabalhado qual e o segredo - trabalhe na força do ódio 	0
4197	1407763977195690000	magoaram o damon sério bando de fdp	0
4018	1511116453709336583	juro meses pra lançar a nota e quando lança eh errado 	0
2430	1511115070692282371	Alguém me explica plexo coróide pelo amor de Deus esse trem tá acabando com a minha vida parece q eu sou burra 	0
593	1511030656184242180	por que todo cosplayer do nanami é gostoso (com todo respeito) 	0
2833	1407767412288720000	aff que inveja	0
2563	1511042338340188169	Forças de segurança reprimem povo de comemorar título no futebol. Impede que um Padre alimente pessoas em situação de rua. O Estado fascista agradece. 	1,1
260	1511030406606430216	Tô assistindo Gilmore Girls pela bilionésima vez. Sempreee amei a Lorelai, mas dessa vez tô achando ela chata kkkk fala demais e às vezes nem tem graça zz 	0
2964	1511029373008289793	mostra ☝️ tua força 💪 brasil 🇧🇷 e amarra ➰ o amor ❤️ na chuteira 👟 que a garra 🐾 da torcida 👥👥 inteira 🙌 vai junto com você 🏃 brasil! 🇧🇷 mostra ☝️ tua força 💪 brasil 🇧🇷 e faz da nação sua bandeira 🇧🇷 que a paixão ❤️ da massa inteira 👥👥 vai junto com você 🏃 brasil! 🇧🇷 	1
3262	1511030999525777423	Meu medo era ontem falar pra ela assim que saiu. Ainda bem q a Rafa e a produção tiveram bom senso! #bbb22 	0
1966	1511116947743813640	cara isso aqui é insuperável, a vergonha de toda luanete 	0
3335	1511042602124124161	Um alívio saber que chegando em casa vou poder ficar deitadinha porque já fiz tudo que tinha que fazer ontem 	0
2875	1511042616447614977	resolver os problemas dormindo&gt;&gt;&gt;&gt; acordei pra ir pra terapia e dps vou dormir dnv 	0
3408	1511121924126134277	sonhei com alguns amigos acho q é um sinal pra eu jogar no bicho 	1
3583	1511028072862167043	Quero somente os verdadeiros, os que celebram comigo e que apesar das minhas falhas sempre arruma jeito para conversar comigo e falar onde errei e eu da melhor forma tentar consertar o meu erro e não deixar mais acontecer. 🙌🏼 	0
2823	1511121371463573505	sexta é tudo pelas partes da união 	0
2416	1511115320894836745	Queria saber o que é ser 'responsável' para esse cidadão, pois em um país sério todos os seus vídeos estariam fora do ar por desinformação 	1
4487	1407760200245840000	Se eu falar que não quero, tô mentindo	0
1570	1511121781985320974	que cena foi essa meus amigos n tava preparada 	0
2653	1511117777058377742	é uma desgraçada mesmo 	1
4098	1511120741277880332	tocar outros corpos não é igual a te tocar... 	0
1840	1511046123682734085	Eu chamava meu ex de papai, sem querer 	0
1247	1511033015836811270	cnco pelo amor de deus faz o anúncio logo tem cachorro latindo criança chorando 	0
2001	1511034164396634117	#Estudioi Esse senador é tão empenhado, só que gasta energia em causas 👎 Ele vai ganhar de novo por culpa de vocês. Esse empenho errado só aumenta os votos nele. 	1
2468	1511033050725027842	Aniraaaaa você é inteligente, não propague o esteriótipos de país das sensações. Onde o pessoal só vive de farra mulheeeer 	0
2408	1511120291770085380	so queria viver um romance igual da bong soon eh pedir demais? 	0
2668	1511033576766251009	Evelyn nem um ano tem tá uma benção minha neném  fico rindo as crianças tá muito pra frente real 😂😂😂😂😂😂 	0
3546	1511122363886231554	Quero companhia p aproveitar essa promoção da ak quarta-feira 🙃 	0
986	1511115008016625669	Na moral preciso de um carrinho🤦🏾‍♂️ 	0
2082	1511036553195360259	Meus amigos da escola sofrem tanto tadinhos implico toda hora e ainda rio sobre 	1
3857	1511116981268889610	Amoooooo jogar tudo fora 	0
2632	1511042497656639498	Se o Gustavo for pro quarto secreto vão falar só que o Arthur é o mais forte mal vão falar dele… já o Arthur saindo vão falar dele o tempo todo falando que ele não era o mais forte e ele sabe que o público deu esse poder pra ele com isso iria utilizar se não seria um tiro no pé! 	0
2935	1511045340161523727	o clima tá amistoso 	0
2424	1407705320294650000	reconheceu o erro,ótimo aprendeu com isso,mas no meu time não tem espaço pra racista,agora pode rescindir o seu contrato e meter o pé do meu corinthians!	1
101	1511117647462686726	Que asco 	1
4482	1407885014159830000	Saudade de beber umas cervas com a minha cuma poxaaannnn	0
2043	1511040502614921224	Inacreditável! 	0
1486	1511030915341996035	Gostoso e carinhoso,não namore ninguém antes de lembrar o meu gosto 🎶 	0
594	1511033037798219776	Eu quero fazer várias coisas ao mesmo tempo e digito o mais rápido que posso, depois vou ler e escrevi tudo errado... pqp 	0
946	1511029923707863042	Hoje um pct me dispensou, mas não por ter acontecido algo, mas pq ele conseguiu fisio de graça. Ele me agradeceu tanto, mais tanto que fez meu coração transbordar por está no caminho certo e por sempre ser eu mesma ❤️ 	1
1901	1407452617912020000	o hoseok tbm de cabelinho cortado e que cor linda ficou maravilhoso	0
1258	1511030060777676800	Se a minha contagem não tá errada, esse mês vai ter só 18 dias úteis. Se organizar direitinho e derem um certo ponto facultativo, só vai ter 17. 👀 	0
1683	1511034339836010498	nft é uma bosta mesmo pqp 	0
3766	1511030326218346498	fiz o exercício de física todo errado, vou me m 	0
2158	1511037803844575245	Acho que a maior tristeza da minha vida é que eu não vou poder viver uma história igual em Bridgerton, que não vou para um baile com vestidos da alta sociedade britânica e nunca terei um Simon GOSTOSO Bridgerton pra chamar de meu 	0
1455	1511029465412947976	Doeu mais retocar a tatuagem no dedo do que fazer a tatuagem nova 	0
506	1511045208158490631	Medo de um rato entrar pelo cu ou uma barata aparecer🤕🤕 	1
1453	1407862272148610000	A falta de educação sexual para meninas da periferia é uma realidade muito infeliz que me deixa sempre paralisada de medo e angústia	0
3301	1511120273512226820	Deus me livre 	0
1205	1511037505084268553	tanta estima que achava que apenas o 'amor' dela conseguiria contornar o que quer que Simon tivesse sobre si mesmo a respeito do passado. Achei péssimo também a cena em que ela força o sexo com ele praticamente bêbado e em como em nenhum momento no livro ela se mostrou 	1
3981	1511033104936452107	Eu não tenho o meu botão de eliminar ansiedade. Eu não bebo, não fumo, nem uso mariajoana. Tenho medo de viciar em qualquer coisa. Nem comer eu uso pra lidar com ansiedade 	1
2109	1511028793598746631	Pqp tudo dando errado hoje 🤦🏼‍♀️🤦🏼‍♀️🤦🏼‍♀️ 	0
1175	1511118779937431554	que vergonha, nn sei aonde enfiar a cara 	1
4330	1511042724513951746	pensando em pedir pra alguém entrar na minha conta do genshin e dar pull pq quero constelação de xiangling ou sucrose mas medo de vir o ayato💔 não odiaria mas seriam desejos perdidos pro kazuha e tô sem condição de farmar qualquer coisinha é preciosa 	0
4121	1511122369032638466	Muitos vão te desmerecer, mas isso é só medo de te ver crescer! 😉🙃☺️ 	0
1251	1511116322041741313	eu qria muito que pelo menos uma vez na vida isso desse certo 	0
4001	1511030173361127430	mas quando eu cago tb saio como errada, não sei o que eu faço 	0
3157	1511046237646168066	15:20 🙏🏻 obrigada pai 	0
3184	1511034412150018056	Quando tô duro quer fala que tô na merda Quando tô com dinheiro n larga meu cartão 	1
2567	1511116386378166276	Tem que cassar esse sujeito! A tortura não pode ser naturalizada. Tortura é crime! 	1
2951	1511116072518307849	Que dor de cabeça 	0
3475	1511119404255354886	Mds se rebaixou ao ponto de entrar no meu Instagram msm dps da merda q fez 	0
147	1511033864499593219	eu gosto de transar ouvindo MD Chefe - Tiffany 	0
2572	1511118274926465024	Mano, tem gente culpando o cara que teve o celular roubado 	1
3304	1511115452012978177	Muita dor de cabeça 😔 	0
4174	1511036198919319559	esse ano tá a carinha do mingau ser rebaixado igual ao cruzeiro em 2019, só tá dando merda atrás de merda 	0
2073	1511119425491116033	“Você é poderosa sabia” “Sabia sim” Agora lembrei pq essa merda de tinder tava desativada 	0
1786	1511036566365511690	Absurdos continuam acontecendo 	0
2084	1511036476934524938	Meus gerentes tem uma mania mt dahora de me ignorar   Queria entender oq tem de erado cmg, ignorado na roda de amigos, no trabalho, por colegas 	1
3518	1511038730903212035	vou dar rt nisso aqui de novo, pq como bem falaram, já apareceu gnt falando q fui atazanar advogado, quando quem começou com essa porra de julgamento e profissional da área foi essa pessoa aqui, elriel stan como vcs.   reclama com as amigas lytha, sobre as carteiras tbm. 	1
3311	1511040238713507846	Não se pede condenação em honorários advocatícios em mandado de segurança. Não se pede condenação em honorários advocatícios em mandado de segurança. Não se pede condenação em honorários advocatícios em mandado de segurança. Não se pede condenação em honorários advocatícios... 	0
1145	1511028257549860874	Um conselho pra vida: não esperem nada de ninguém!!! Nem carinho, consideração, lealdade, nada. Esse é o pp 	1
2241	1511115368294760454	amor é só de mãe mesmo. 	0
4490	1511038597981511686	O cara traiu a mulher 50x  O cara votou no cara que tá sendo responsável por nossa infelicidade  O cara é um mimadinho, macho branco confortável  Quem tem que ir pra esse quarto secreto é a Lina pra voltar mais forte e acabar com o ego da macholândia  #bbb #LinaNoQuartoSecreto 	1
2190	1511114320591175681	O povo tá precisando aprender a reconhecer amor. 	0
312	1511028140356821002	meu deus que dor 	0
3563	1511114877816954880	Nada dando certo p mim nessa porra 	0
2410	1511045014201196564	sinto q depois que sai da casa da minha mãe minha alimentação decaiu horrores 	0
4136	1511040961039720448	Chega um momento em que você não conversa com ninguém, que nenhuma conversa te enche e você para de responder, você apenas desfruta de sua própria companhia, esperando por uma pessoa extraordinária, afinal, tudo de bom e saudável vem no devido tempo.	0
1192	1511045402136612872	Tô vivendo pelas fotos dessa selva, não sei se to ansiosa ou c medo hahajajajja 	0
3598	1511032176590135304	Adivinhe quem essa figura apoia. 'Ah, tá na cara, né?' Será? 	1
4129	1511121089648283650	que linda essa lua, queria ser bonita igual ela 	0
4201	1511119388031791111	igual a adora e a atena 	0
2014	1511117875028934660	é uma merda sentir sua falta e não poder ir até você 	0
3614	1511122414473777161	De valor a que realmente mereça o seu respeito , sua família . Esses sim estão com você . . . Muitos diram ' tamo junto mano ' e realmente são os mesmos que depois de serem ajudados por você te darão as costa sem pensar 2x 🥱 #pegaAvizão 	1
152	1511045436576079877	a minha mãe olhando os meus cards do seventeen e perguntando se eles já morreram???? kkkkkkkkk 	0
3772	1511030935126425603	tô c dor no peito acho q é sdd 	0
1611	1511116070492459011	eu com raiva = escrevo tudo certo e arquivo 	0
2950	1511046311386173443	Vetaria #BolsonaroMentiroso 	1
1381	1511027709706747908	Pó parceiro tentou enganar o cara errado! 	1
1639	1511038145248251910	Os professores deviam entender que depois de rolê, a aula deveria ser cancelada... 	0
2090	1511039787255439367	Trocar o Rigoni pelo buesta é uma baita sacanagem, q isso seja mentira 	0
407	1511114453110120450	a arte de milhões, amei 	0
2053	1511114625940656143	eu queria poder conversar sobre... mas certeza q eu seria julgado e no final acaba n dando certo 	0
55	1407874780884340000	homem me irrita tanto, q maldição	0
2946	1511122011166318594	Eu acho engraçado que todo mundo pensa que eu sou obrigada a tudo. Todo mundo acha que pode me tratar com de forma desdenhosa e sem respeito e eu sou obrigada a aceitar. VAI TOMAR NO CU! 	1
1677	1511118677638328323	Quem não me conhece acha que sou nojenta e antipática, mas abriu a boca acabou kkkkkkkkkk 	0
987	1511031774008299528	Anitta é norte Anitta é nordeste vai 17 vai 17 	0
1067	1511121662728712201	PR está 'deitando e rolando' com nomeações de amigos dos filhos. 	1,1
3595	1511117210126884865	Eu não aguento mais a humilhação 	0
2559	1511118927514021895	Continuo na minha saga em fazer novas amizades pra dispensar as mais antigas. Tá sendo um processo bosta mas pelo menos tá indo. 	1
1304	1511122104476917764	Odeio meus amigos que namoram e são felizes enquanto eu sou solteiro e triste 🤬🤬🤬 morram todos 	0
4184	1511043468562419714	Acho q agora vai, temos um Uruguaio e um Carioca no comando. 	0
1335	1511043841687625728	Querer es poder 	0
3276	1511033614502445063	A Anitta mostrando pro Mundo que no Brasil só tem sexo bebida e prostituição 	1
2674	1511032881136685064	Eles são tão lindos 	0
1665	1511038192283271168	meus amigos flops e a myka não tem o senso😥 	0
255	1511119142761414661	eu tenho muito nojo de quem expõe paciente em rede social e ainda por cima debocha 	1
1279	1511029629829722115	os maiores 	0
2147	1511121137647902723	O Simba está comigo a 5 meses e só de eu ir no mercado uns minutinhos e voltar, ele está com lágrimas nos olhinhos por ter sentido a minha falta... Deus q me livre doar o meu bebê, qq essa gente tem na cabeça 	1
1801	1511036354028871683	SÃO PAULO  É HADDAD  👇👇👇👇👇👇👇 	0
3629	1511120760177315844	as coisas tem sido tão difíceis desde que eu perdi meu pai, faz tempo que não me sentia tão angustiada e sozinha igual eu me sinto agora 	0
915	1511030058164662275	dor de garganta da pega ein pod só de menta agora 	1
4357	1511118943536443392	O tanto d merda q eu faço n tá escrito 	0
2521	1511035689151963146	sds de qndo a gnt ficava igual namoradinh*s 	0
3423	1511117318218264579	ana katharina parece criança 	0
335	1407875351691340000	Finalmente	0
551	1511118774430228480	graças a Deus não faço parte disso kkkkkkkkk 	1
3499	1511036832334721032	enfim os 18 da gatinha chegando e além de me prejudicar vou fazer isso com meus amigos 	0
2114	1511036764231811075	Tô muitooooo feliz meu parceiro ce tá loucoooooooo 	0
1716	1511034650877173770	eu tô cansado desse sentimento de exaustão de tentar fazer tudo certo mas não funcionar pq eu sou tapado 	0
1942	1511118224921964552	não é de muita serventia quando a “artista” em questão permite que os mesmos cantem isso em suas músicas, quando ela fala que prometeu uma noite de sexo para amigos gringos na festa de aniversário dela, quando a mesma posta de foto de crianças pretas seminuas nos stories dela + 	1
2955	1511121449473687555	relacionamento só dá certo qnd ele ama mais q ela 	0
2029	1511118288285310982	A pressa que os Estados Unidos e a OTAN têm em incriminar a Rússia é proporcional à pressa em ocultar os próprios crimes. 	1
718	1511033973358616578	perfeita NUNCA ERROU 	0
3082	1511116902340472834	hoje eu ouvi isso a respeito da dor do luto: 'você poderia ter evitado isso sim. Você nem a conhecia, nem era próxima' 	0
3103	1511034309704101890	com todo respeito mas eu n aguento mais esse homem cuckando essa mulher. pelo amor de deus cara get a job 	0
140	1511028866684538887	Cês lembram do sem rabo não vale nada? 	0
1880	1511116404518494215	Anita não está errada todo mundo quer se divertir e transar sim hipócritas 	0
1097	1511034744326164480	A pressão psicológica que estão fazendo no Will é surreal. Foi errado o que ele fez? sim!!! mas isso não é motivo para massacrarem ele ao ponto dele se internar numa clínica enquanto tem milhares de homens que já cometeram crimes muito piores e que hoje são aplaudidos de pé. 	1
1029	1511043112495468544	meu deus o carro tava muito rápido, que a justiça seja feita viu pq ainda tem muita coisa mal contada na história do motorista 	1
4341	1511043708963143684	meu coração fica sempre apertado qdo ela fala q esta enfrentando uma crise de ansiedade 😞 é tão ruim se sentir assim só queria poder ajudar. 	1
583	1511032008981495823	eu que me foda, achei q não ia dar merda perder um dia só de de venlift, to aqui passando violentamente mal, com o mundo todo girando, desorientada, não sei nem em que universo eu to. como pode uma cápsula de 150mg deitar a porrada numa mulher adulta? 	0
1841	1511115471034228741	estou com uma dor de ombros e costas horrível 	0
91	1511116185261289478	eu amo esse vídeo 	0
930	1511118892323807235	Fiz merda de novo vsf 	0
3554	1511031184259756032	Comecei a ler The Crown of Gilded Bones, mas me pegou mal pq absolutamente TUDO dá errado nas 30 primeiras páginas. Essa autora vai me infartar qualquer hora. 	0
3008	1408029210145340000	Concordo plenamente 👏🏻👏🏻👏🏻	0
1628	1511034794188095489	'nao gosto mas respeito' 	0
102	1511034611756941314	Geral da certo de encontrar alguém que seja recíproco, e eu vou lá e encontro a mais vacilona 	1
1866	1511037622197620745	Lula faz tweet em defesa da Miriam Leitão, mas a Globo, onde trabalha Miriam, insiste em colocar Bolsonaro e o ex-presidente como se fossem farinha do mesmo saco. 	1
2872	1511028983407820800	Nunca mais assisti o BBB22 e tô tentando entender pq a internet quer tanto o Arthur nesse paredão falso. Aí lembrei q não tô mais assistindo pq esse amor da internet pelo Arthur é irritante, cansativo e sem sentido nenhum! 	0
1884	1511034957573066753	Por essas e outras q quando alguém chama pelo nome errado eu fico 🤔🤔🤔 	0
4124	1511030673469063168	um abraço dela resolveria tanta coisa 	0
1416	1511120766028369927	e daí se ele é criminoso?? eu n sou da polícia 	1
1155	1407857299817910000	Porra aí tu me quebra 😭	0
2326	1511122339244744708	no twitter tem que ser assim hj em dia 	0
2144	1511114583494336513	tô morrendo de dor por favor me deem docinhos e beijinhos 	1
2233	1511117061426237453	Tento fazer de tudo e nada tá certo 	0
2704	1511031610879135751	QUE ODIO DESSA MERDA DE COLÉGIO 	0
208	1511039047988576256	to nem crendo que eu vou ter que usar aparelho de novo, sacanagem 	0
1193	1511044647518453764	no oftalmo com medo dela dizer que fui pra 15 graus de miopia num olho e 27 graus no outro 	1
4176	1511032825889406982	Como se isso fosse evitar alguma coisa 	0
724	1511035778872365057	FOMOS ENGANADO POR VÁRIOS ANOS PELO CARNIÇA QUE CONSEGUIU ROUBAR ATÉ A NOSSA LIBERDADE 	1,1
1007	1511028729983741954	Tô com mt dor de dente, pqp 	0
19	1511034860655321088	Só é ilegal se a polícia descobrir 	1,1
2516	1407829951253020000	é vergonhosa a posição do Grêmio na tabela.	0
1316	1511117739431182343	nossa se for p dançar isso prefiro nem dançar saio dessa merda em agosto e cabo 	0
54	1511033222418907139	como se brasileira não fosse vista assim lá fora há tempos. e reduzida a isso há tempos. pra vir a bonita agora e achar legal contar isso pro mundo. pega e faz filha não precisa dessa humilhação internacional não obrigada. 	1
1859	1511036091121471499	esse negócio de chegar em casa e ter um monte de amigos mandando mensagem me deixa muito feliz 	1
2295	1511117343874813958	me sentindo mt maduro pq alguém falou bosta para mim e eu nem fiquei puto  hahaha isso que é controle carai 	0
1088	1511038693645111299	essa mina é igual a mina q eu ficava 🆘🆘🆘🆘 	0
4000	1511045286692589568	minha chefe é uma foufa a mona é justa e paciente como era jesus 	1
3911	1511117582035832832	nem consigo ver call me by your name de tanta vergonha alheia que eu sinto 	0
4199	1511043123522289667	a criança aq no serviço berrando p fazer cone chines, tadinho o medo deve ser maior 	0
2313	1511117544890982400	Que raiva, cuidar de 20 crianças até entendo, mas cuida de 1 e deixar voltar assim pra casa? Tá de palhaçada 	1
