2727	1511038354971934722	incrivel como hunter x hunter é superior a qualquer outro anime do genero e não é nem uma competição honesta   Naruto pitico de mais 🤏🏻🤏🏻🤏🏻, nunca será 	0
3227	1511032672348479491	tudo o povo é cancelado, a pessoa tem uma opinião diferente da sua e massacram ela, mandam ela morrer, PORRA ENXERGUEM QUE NÃO EXISTE SÓ A MERDA DA OPINIÃO DE VOCÊS NO MUNDO 	1
547	1511043348286611461	Odeio ter q ficar cobrando esse povo todo, a pessoa sabe que te deve e fingi demência. Não é possível, cada coisa que escuto de desculpa que doi os ouvidos. Tem gente q colocou a mãe no leito de morte, misericórdia, isso pra não pagar né! Ser boa da nisso. 😡🤡 	1
1079	1511122725150105607	pior que eu acho que o baco tem olho de filhote 	0
850	1511033720207290369	Quase postei uma merda, mas apaguei   A tempo kkkkkkkkkk 	0
228	1511031500321476610	Amanhã começa mais um ciclo e vou dessa vez vou fazer dar certo 🙌 	0
37	1511031881101365250	tas a falar sem ver os jogos, cala a boca cão de merda 	1
4306	1511116745238581265	nunca deu errado 	0
1982	1511033289188024325	off da paris manipula crianças sim! 	1
4480	1511118168005259264	Minha vida é igual UNO       quando tô resolvendo um problema, chega +4 	0
2781	1511122590064070660	A gente vira mãe e realmente vira mulher maravilha. Gael doente, praticamente não dormi, fiquei sentada pra ele respirar melhor, trabalhei embalando ele com as pernas enquanto usava o pc com as maos e ainda ficava fazendo palhaçada pra ele n se sentir sozinho 	1
3816	1511034546116042761	tô na merda, meu Deus 	0
1699	1511029359557152784	Quando feedam a irelia do outro time 	0
1620	1511122099158540289	ainda procurando 🤙🏻 	0
2409	1511036495121072135	Parabéns ao RGS por ter a oportunidade de eleger vc Sucesso patriota! 	1
235	1511123207339839496	Intimidade é uma bosta eu mando foto de tudo qualquer jeito no nosso grupo com os meninos 	1
1751	1511039158684422147	não vou negar que meu maior sonho é que o trio saia do org e fique livre desses doentes que só sabem falar medida, mas sei que isso vai demorar ainda felizmente (ou infelizmente) 🫠 	0
3920	1511042024958529546	Hahahhahhaa eu sendo mãe 	0
1879	1511045544998756357	meu pai ja ta se acostumando c a ideia de q vou sair de casa kkkk, td gr ele comenta 	0
1347	1511037982265987072	Rompi o ligamento, vou ter que operar meu joelho e só vou poder jogar vôlei ano que vem. Deus pq o senhor não me mata logo 	0
2948	1511118274389585925	isso é de deixar qualquer um puto 	0
297	1511121770069250053	A justiça do homem pode até falhar, mas a de Deus não falha nuncaaaa! Deus pesa a mão !!!!🥰🙏🏻 	1
3328	1511029493653200901	Tava fácil demais pra ser vdd Tô achando q eu errei metade 	0
1223	1407819997754310000	ok “mandraka“ eh uma coisa tão vergonhosa	0
2465	1511120145015578625	Perdi o timing do flerte e agora tenho uma grande amizade kkkkkkkkk 	0
137	1511116480611500040	A gente fala essas paradas de grupos de wpp e lembro quando fomos criar os Brows kkk a gente dava a vida nas regras 	0
3049	1511042804478316553	as respostas desse tweet mostra como o twitter é insuportável em tempo: sorvete da baccio é MUITO forte. 	0
1048	1511122476868247556	bj sua bochecha quando na vdd eu queria estar bj sua boca é a maior tortura pqp mano 	1
353	1511031980883861514	É verdade, eu era a passadeira 	0
446	1511044332102598669	Espanha, nunca critiquei 	0
2057	1511115572955729920	Respeito se não ele vai te por de castigo 	1
3482	1511035662690144259	é incrível como esse povo ta agindo assim, me dá uma revolta pq eu n consigo entender o pq de tratarem dessa forma 	0
2943	1511043385938874372	Minha mãe está ficando velha 😪 	0
1411	1511115995552706562	hoje meu coração doeu 	0
832	1511031457770352653	O tempo é a senhor da razão de tudo, a soberba desse merda aqui será castigada 	1
1775	1511120624101507075	eu estar numa turma cheia de gente feliz de tá na faculdade é sacanagem das grandes 	0
856	1511038164256841737	Vcs força tanto, jss misericórdia 	0
4167	1511118501255294978	Cadê a JT gente 	0
3387	1511041591649124363	O povo não é idiota, o povo sabe que todos são inocentes…. Vai Brasil!!!! 	1
1554	1511121496030208003	Eu percebi que eu realmente não tenho amigos, são tudo um bando de fdp 	1
4352	1407734601502670000	Quem se incomoda em ser cringe não é cringe minha gente, quem se incomoda com esses nomes etc é o adolescente, entende? Kkkkkkkk	0
1269	1511032333377363973	o proletariado nao tem um dia de paz mesmo, quando achei que as coisas iam começar dar certo, muda tudo e da tudo errado, cansada já 	0
3369	1511034795865919497	queria tanto que desse certo 	0
1014	1511117865629401088	Gente, tá aparecendo esses trem de previsão pra mim todo santo dia. Eita universo 😏😏 	0
2065	1511038737475678218	Vou desativar minha conta nessa rede social, abraço amigos! 	0
4132	1511122296433528837	a pessoa confia em ti pra falar certas coisas e tu vaza, isso não é legal nao só é falta de caráter mesmo 	1
1266	1511121195495792648	Respeito sempre acima de td 👏🏽🥰 	0
3374	1511038317927845896	Eu juro que tenho medo das mina de bc elas ficam me olhando com uma cara sla, dai fico com medo de dar oi mas ao msm tempo faria amizade? Scr KKKKKKKK 	0
3158	1511030469596491781	era so um role sushi e meu amor p me fazer feliz hj 	0
1338	1511034114350137345	Cara toda vez que eu vejo esse vídeo do Poze sendo esculachado pelo policial, sendo chamado de MC de merda acaba comigo, eu sempre choro ! Muito orgulhosa do meu menino 🥰😭 	1
2916	1511043070539988992	duas semaninhas de férias pra encher minha barrinha de life, não estranhem os vácuos na DM até a semana santa ok? no mais se hidratem e hold tight que o pai jajá tá de volta, 2022 vai ser outro sabor 	0
1465	1511036715191910405	Entrei no inst4gram e me lembrei pq eu não entro nele: todos os meus amigos e ex colegas tendo bodas legais e eu estagnada dentro de casa 	0
972	1511114955172589574	não se comparem com a minha dor. é ruim quando eu digo que tô mal e a pessoa parece que fica querendo competir qual é a dor mais forte. 	1
4019	1511113910543425542	Sim sociedade, um dos meus sonhos é ser mãe ;) 	0
4248	1407740838747190000	Dr. Estranho é o filme mais confuso pra mim. Acho a história complexa e ainda tem a questão de eu não conhecer o personagem como eu já conhecia os demais.	0
3700	1511037019203547136	portal do aluno tá igual o site do inep no dia que liberam a nota do enem 	0
419	1511039525228797953	Tenho que aprender a ser exatamente igual as pessoas são comigo 	0
3327	1407756371580300000	O que rolou aqui? Kkkkkkkkk	0
2761	1511115453279711238	já faço isso sem namorar, imagina namorando 	0
1414	1511121009016983558	reclamei tanto de nao sentir nada que agora to sentindo tudo de uma vez e isso ta fodendo a minha cabeça  ESSA NAO É A LEI DA ATRAÇÃO QUE EU PRDI 	0
2840	1511116624933367812	Meu Twitter hoje tá uma bosta misericórdia 	0
4244	1511046092514902018	Juliana q vai fazer uma tatuagem em mim, quando eu perder o medo de ter um desenho permanente na pele ksksksk 	0
3135	1511115098923978753	só sendo burra mesmo pra achar que esse almoço daria certo #QuantoMaisVidaMelhor 	0
4088	1511115761443557392	N tô aguentando a dor na canela não, tô custando andar 	0
53	1511033645389201417	imagina ser fã de h*iley b*eber kkkk puta merda 	0
3360	1511035608801726466	aaaa um aparelho em companheiro 	0
4332	1511114659696463874	Dor de cabeça do inferno 	0
2666	1407858361002070000	Gente kkkkkkkkkkkkkkkk tem umas coisas que a gente vê e só agradece pelo livramento 🙏🏻🙏🏻🙏🏻🙏🏻🙏🏻	0
791	1511044615184523268	Aí que mulher sebosa, meu pai 	1
2604	1511041473076203526	se ela soubesse oq a própria mãe dele falou dela eu choravaKKKKKKKKKKKKK 	0
1317	1511036807366029317	Só assistir sem o olhar do fanatismo e vocês vão descobrir que essa é a mais pura verdade sobre o P.A 	0
3050	1511123228164595713	Eu amo quando minhas amigas fala que tenho uma cara sinica😂💜💜 	0
2343	1511036996243922952	o peito siliconado vem amigas 🙌🏻🙌🏻 	0
1693	1511035871935488005	Tô suando igual uma safada, esse calor tá surreal ainda passei hidratante 	0
1647	1511029495364571140	dor de cabeça pra fazer esse título 🤯 	0
4312	1511029004215726082	ai eu sei a importancia dessa coisa eu só fico irritado pq nenhuam demonstração disso é natural, é sempre invocando coisas de forma aleatória e ir colando desigualdade. 	0
657	1511039491770826755	Cansada de eu sempre ser a errada com coisas de tempos,vou me afastar de todas minhas amigas papo10 	1
2769	1511115826363047945	Vou transformar decepção em novo começo. O passado é um erro, o presente é só acerto, amor eu te prometoooo 	0
149	1511118579604856837	Cansada desse fedor de côco é mijo de gato cr 	1
3460	1511042860619083778	meu pai disse q to ouvindo musica mto alto fodase 	0
943	1511114596660256776	o povo defendendo a assessoria de merda dela véi PELO AMOR DE DEUS o trabalho deles é avisar sobre tudo o que estão falando dela e darem um jeito nisso eles não se dão o TRABALHO de gerenciar as redes sociais dela de forma correta mano 	1
3155	1511120336779100160	Alguém me segura pra eu não entrar em mais um grupo de extensão 	0
1656	1511120784160350209	agora eu quero ver o pau torando 	0
332	1408049214177920000	realidade: inveja	1
4335	1511030419474587649	Só queria que as coisas dessem certo para mim também x2 	0
852	1511036409720807434	nossa troca é sincera, a gente conversa sem medo um do outro, oq eu tenho pra dar e o que eu quero ter em uma relação é carinho, respeito e admiração, a gente se olha de igual pra igual e eu sinto que é isso, me sinto cuidado, amado e querido e queria dizer que você me faz bem 	1
1036	1511042424839163906	Juju mano dura no afloje presidente 	0
1703	1511038621658275852	Amigos, indiquem séries please? 	0
503	1511114610589503491	adoro sofrer como se fosse uma puta fodida no amor sério 	1
1573	1511036827679039495	eu vivi 	0
320	1511119202727440386	Eu sou um merda 	1
3172	1511119618676563972	Isabel é igual meu irmão mais novo kakaakakkka cheia de doce 	0
2877	1511118354815275008	Preguiça de escrever nessa merda 	0
1003	1511036411725635590	De sacanagem eu vou colar no seu rolê só pra causar 	0
4250	1511033050083172353	eu não subo nessa merda nem pagando 	0
1311	1511116724699025413	caraio 	0
954	1511115246089429003	Ficar assim com ela ia ser incrível 	0
1151	1511037386913947655	Nem cheguei na escola direito e já quero ir embora 	0
4102	1511046275432599554	'se você vive sempre com medo, sempre com o perigo em seu encalço, não fica tão difícil fingir que não existe mais perigo.' 	0
601	1511031496043286530	Secretaria de Saúde de Mendes é um puto de um descaso mané ... Terceira vez que vou vacinar a Anna e agendaram a vacina dela pro dia errado ... TRES VEZES 	0
3635	1511037381322985473	E minha vó que fez um grupo no wpp pra mandar link de concurso público kkkk ela é demais 	0
98	1511116352806871041	linguagem de amor do meu gato é toque físico 	1
2740	1511121757389959172	Faz três dias que eu tô tentando toma uma ceva com alguma amiga só pra conversa um pouco, todos eu não consegui, passei os três dias sozinha, só não bebi, pq odeio bebê sozinha, não é apenas tempo que me falta, é amizade que esteja disponível pra mim tmb 	1
4413	1511029013501947904	dor de cabeça, dor nas pernas, nos pés, no corpo inteiro 🫠🫠 	0
40	1511033835395371010	Isto é religião ...Parabéns Padre JULIO LANCELLOTTI. 	1
1832	1511031175548182535	é tão engraçado ver essas mina/mlk mudando de time por causa de namoro kkkkkkkkkk o amor faz coisas surpreendentes 🤮 	1
2480	1511121628490567690	eu amo sair com os amigos do Carlos pqp, me sinto super acolhida e eles sempre se importam cmg e fazem questão de eu e o Carlos está ali e já viraram meus bff 	1
1791	1511030366047555585	vou ter que defender o ayel nessa aí ele tava certo 	0
2751	1511044515364323332	É muita crueldade bicho. Isso é pra quem defende o governo da Ucrânia 	1
113	1511037695879004163	Ainda falta 10 reais. Muita dor na mão, estou esgotada 	1
1698	1511029269174136834	um dia um gago me falou que a mulher que ele tanto amou fo fo fo foi embora 	0
934	1511044532430909449	sou dona de td q me pertence 😮‍💨 	0
454	1511040074078638086	esqueça tudooo 	0
3852	1511119682371309568	Tô sem almoço, e tremendo igual um pincher. :/ 	0
722	1511044187055177728	Voto em 99% em quem o presidente apoiar, porque aquele 1% eu sei que vai decepcionar. Datena é um desses. 	1
2830	1511122126639706116	Eu devo ser uma mulher muito à frente do meu tempo mesmo.. pq eu leio cada coisa das mulheres, que eu só penso que eu tô no tempo errado. Como que filho é da mãe? Como que a mãe que deixa de fazer tudo? A mãe que se ferra toda? Ahhh monas, acordem para a vida de vcs hein..😡 	0
1108	1511038809084997632	É mais um dia que ele me mostra que ele não está preparado para um relacionamento... 	0
2549	1511114158271574022	Agora até a mãe dela me segue no ig mds😭volta de uma vez amor 	0
2052	1511116294950723586	Bem isso 	0
411	1511031863648915464	vem agosto quero ver adolescente rico se fudendo 	0
4191	1511033382330937344	Crl,q merda 	0
3185	1511028005279354890	EU AMEI 	0
122	1511031998848155650	brasil = putaria 	1
2663	1511044369167568907	mais um dia eu querendo tomar um tarja preta p dormir e n aguentar minha mãe 	0
394	1511116575671296001	Tinha logo um mano com cabelo do Bin Laden no metrô, pensei eu q essa época já tinha passado na moral kkkkk 	0
4162	1511122095287283715	totoca saiu do grupo, agr eu tô com medo de ir pra facul KKKKKKKKKKK 	0
1651	1511114022925619216	De cria 	0
2618	1511045198226333702	As correntes teológicas a respeito de como essa salvação acontece são variadas. Mas o princípio básico é de que a conversão, a aceitação do Cristo e o Arrependimento devem acontecer durante a vida de um determinado sujeito. (7) 	1
1377	1511028559338479618	E se me provocar, já sabe... Vai ter mais fotinhas Só que agora junto com o amor da minha vida, o cara que sempre tive respeito. 	0
3936	1511121058279088130	DNA No caso do genossa é: D- desonesto; N- nazista; A- abominável 	1
4389	1511118737956429824	somos duas criança querendo ir no pula pula grazadeus 	0
1733	1511113930097242117	Dito tudo isso, estou com Ciro. E quem não gostou, amor, é só por na borda do prato ou engole porque é isso aí mesmo. 💋 #SPcomCiro #RJComCiro #BRcomCiro!!!! 	1
2839	1511040408993865736	eu assim mesmo depois de tatuar meu corpo em homenagem a eles mais de uma vez 	0
396	1511115961541312515	que de td certo amanha 	0
3701	1511119046237896705	outras eu já teria se humilhado 	0
1100	1511041360362672138	Sérgio Camargo ofende os AFROS SEM QUALQUER cautela, Eduardo Bolsonaro FAZ PIADAS COM QUEM sofreu as atrocidades da DITADURA. É ETC .... JURO QUE NÃO ENTENDO. É COMO SE FOSSE UM ESTADO DE DIREITO ACIMA DOS DEMAIS. NA REALIDADE SE ESCORAM NA TAL IMPUNIDADE PARLAMENTAR 	1
2658	1511118333038505990	Strogonoff só não é melhor q sexo 	0
2189	1511115707991347200	nada deu certo e o sentimento que fica é de incapaz mesmo 	0
516	1407472999436100000	aiiin q sdds😭😂	0
702	1511115878175322112	Acabei de entrar no negócio e já tô escrevendo errado, vou fazer dnv não 	0
1825	1511034557784547333	Nessa destruição geral das nossas instituições, a maior de todas as ruínas, Senhores, é a ruína da justiça, corroborada pela ação dos homens públicos. E, nesse esboroamento da justiça, a mais grave de todas as ruínas é a falta de penalidade aos criminosos confessos. 	1
4065	1511042375954620417	Minha mãe é vidente com certeza, tudo que ela fala acontece, nunca errou 	0
2357	1511034071320875014	Cada dia com mais ranço dessa merda de cidade que se chama cabo frio. Tnc 	0
4418	1511122064278753280	vou começar a sair sozinha, porque se depender das minhas amigas eu não vou p lugar nenhum 🥲😩 	0
406	1511043020690534401	Hoje vou treinar na força do ódio, pq olha 	0
1397	1511032612315611137	Vagabundo transou com  uma mulher casada, ganhou fama principalmente por descrever passo a passo da maneira mais nojentas e humilhante. Engraçado que ainda tem mulher que tem coragem de ficar com ele. Marido da mulher bateu foi pouco, era pra ter arregaço esse verme todo. 	1
3052	1511121354845827078	sim, eu iria sorrir para ele na Coreia do Norte 	0
1112	1511030670805643265	Preciso aprender isso... 	0
652	1511045953121398794	Tem dias que eu so queria poder mandar todo mundo a merda 	0
3627	1511120941287452674	meu relacionamento com a Lara é muito tóxico 	0
3763	1511044024051937285	Se você disser que o Lula vai implementar uma ditadura socialista você perde 	1
507	1511040196455845890	mulher aceita cada presepada de homem c uma facilidade... se cada mulher fosse filha da puta igual o homem é e tivesse facilidade em fazer bosta, muitas não estariam do jeito q estão 	0
1110	1511042446242758660	mds q sdds de poder confiar em alguem 	1
976	1511119519179317255	Acerta muito 	0
1886	1511035626249936896	A Palavra de Deus sempre atual. 	1
3101	1511028456619978763	De mas amor do que você recebe 🎶 	0
3807	1511031592990486530	Hoje essa merda toda aqui faz o maior sentido, Filipe Luís covarde! 	0
3307	1511121993164374029	Noss quanto tempo saudades 😭😭 	0
4399	1511032245036924932	As vezes eu prefiro ficar calada, pq se eu abrir a boca pra falar a errada sou eu . 	0
2970	1511118668767404041	ela é muito injustiçada 	1
3661	1511122688634458117	tipo, se ele chamasse só por educação mas nem isso aconteceu 	0
529	1511040623436079115	nao ironicamente na minha cabeça tem uma listinha extensa de todos os meus amigos que nao me deram parabéns espero q todos se explodam 🥰 	1
161	1511041010813612038	só pra ficar esperto Kkkkkkkkkkkkkkkkk 	0
3894	1511046263697022979	Meu pai me mima des de berço pra depois de grande ele vim me chama de mimada kkk tendi não 	1
2718	1407707950496550000	Tirando a última frase, tá certo isso aí	0
2879	1511028989900562438	Aaah meu Deus que decisão difícil. Não sei o que fazer 	0
3684	1511119276366778371	e é por isso que reservo meu direito de ser hipócrita 	0
1388	1511042667328811012	Minha mãe disse pra eu perguntar pra vitória em que salão ela fez as luzes..VEM AI MEU DEUS 	0
1933	1511118305062445061	meu deus esse arroz q eu fiz tá uma merda KKKKKKKKKKK 	0
413	1511033978010193929	Sim. Se for uma amizade verdadeira. Óbvio que é preciso ter limites, sabemos como o ser humano é. Mas não poder chegar perto do sexo oposto??? Eu acho muito doentio!! 	1
4218	1511114846129041413	Se ta acostumado pq ta inseguro? 	0
937	1407877038317440000	As conquista só foram possíveis por causa desse homem aqui... #FreeBritney	1
1515	1511121132858052609	se for pra chegar lá e cobrar só o técnico fica em casa que é melhor. 	0
1184	1511118502127718411	roubaram meu beck atenção cade meu beeeck r7 	1
4198	1511036886613205008	Eu fico tão estressado quando eu não consigo fazer algo direito, dá vontade de sair gritando igual a Carminha “INFERNOOOOOO” 	0
2294	1511036221442637830	Os torcedores do palmeiras tão quase igual os torcedores do Hamilton KKKK 	0
2678	1407877883666830000	Tô aloprando muito botando culpa na ansiedade tenho que aprender me controlar e fechar a bocaaa	0
1373	1511115815571099649	Não existe amor igual a este... Mesmo sabendo que a equipa não merece, nós adeptos estamos sempre lá a apoiar! 	1
2540	1511031572618698752	uma foda4 não vai destruir nossa amizade, eu quero tanto tu pelada na minha base 	0
3561	1511115643625648133	Eu amo a fábula tuiteira de que o socialismo vai distribuir produto de luxo que são feitos pra RESSALTAR A DESIGUALDADE! 🤣🤣🤣🤣 	1
2828	1511114912914935811	Minha cabeça vai explodir na moral 	0
711	1511119998378561536	Muito tempo sem comer fruta e tomar água direito, como eu n morri ainda?? 	1
2986	1511116691610214401	vc sabia ate pastor universal e obrigado dar dizimo  #pintoawards 	0
4379	1511030893233774601	vou falar nada pq se eu falar vou estar errada 	0
3119	1511044388637581315	O poder de Maria mãe de Jesus 	1
3178	1511033844027248644	Eu falei pro Romarinho parar de dar energético pra essas crianças 	0
2062	1511037591717654530	qria estar com os meus amigos ainda 🥲 	0
1945	1511113908970479619	pelo amor de deus eu cometo um crime 	1
564	1511117906200993801	Jesus eu só fasso merda 	0
2166	1511031142815834123	preciso de um abraço 	0
44	1511027863142731783	Wff só cai na hora errada 	0
3725	1511122453094965249	quem diria q o segredo pra vc pegar uma gatinha, eh vc pegar uma gatinha… 	0
4386	1511118799575076871	Fiz 4 empadão no trabalho e saiu igual água fii, eu to dando muita aulas na cozinha rs 	0
2044	1511115550717480960	tem que ser o Gustavo, ninguém mais vai usar bem os controles 	0
3799	1511044490554970115	O povo se mordendo pq o Cristo redentor fica no RJ. Faz um multidão pra cada ano o Cristo ir pra um estado 🤩 	0
4337	1511045310189084672	pior que eu ate poderia comprar, mas to gastando tanto com os trem aqui em casa que fico com medo de comprar alguma coisa e depois a pia quebrar de novo🥴 	0
2998	1511040985412820997	Tempos que não tinha uma segunda-feira tão corrida igual a de hoje, to só o pó e caindo de sono 	0
655	1511030618213212171	tirei foto d umas crianças aqui da ed infantil q eu ajudo a cuidar sera q posto aqui sim ou nao 	0
2278	1407502956036070000	Antigamente amava o frio, hoje eu odeio	0
323	1511122238438875140	O tae com o Jon Batiste, as risadas, a amizade de milhões, fofos demais 	1
2631	1511041990540021769	Tô jogando tanta coisa pro universo que tô com medo de ele virar pra mim e perguntar 'o que vc quer que eu faça com isso tudo, mana?' 	0
806	1511118936011640836	esse mendigo nojento, não aguento mais ouvir falar dele nuoor 	1
2650	1511113876502372354	Eu disse a vc q eu tinha um amor 	0
4053	1511030134379270153	e minha mãe q falou que tava com câncer para toda família pq ela leu o diagnóstico errado 	0
680	1511118024438333441	Minha prima tem umas histórias mt boas de criança em bar mas ela não é louca de contar nesse site, que pena 	0
2470	1511043363759439879	E se diz cristão. 	1
3385	1511043673873600528	eu falando bem da menina pro meu pai e ele falando q ela tava era dando em cima de mim kkkkkk 	0
1137	1511120671849562113	preciso de amigos 	0
3345	1511037282194706433	Queria que minha vida mudasse igual a do Luva de pedreiro kkkkkkkk só isso só 	0
2265	1407463047178990000	Meu pai fez um bolo de cenoura.... que Meu Deus 🤤🤤🤤 Fiz logo uma calda e joguei em cima 😅	0
425	1511117332961243141	Aliás, que imagem de publicidade bosta né 	0
1826	1511042296405495808	Quando vejo esse tipo de coisa fico duas vezes mais feliz por ter escolhido o lado certo. 	0
579	1511121505480069122	pra q aula de filosofia do direito ? 	0
3748	1511041368768098307	Perder um filho é a pior coisa que pode acontecer na vida de um pai e uma mae. Mas torna-se ainda pior, quando fica na espera de encontrarem o corpo. Que tristeza, Meu Deus. 	0
1947	1511029394961502209	Ngm pode me julgar 	0
3218	1511033719288733698	esse “mendigo” tá me dando um nojo do caralho🤮 	1
2542	1511119967688830994	A Bolsonaro mentiroso e corrupto 	1,1
3669	1511034697073238017	QUE MERDA É ESSA CARA 	0
3477	1511039440327745544	Beleza estou na merda mas quando eu for contar essa história ela vai ser cômica com direito a plot Twist e tudo mais Apenas produzindo entretenimento de boa qualidade pra meus amigos próximos 	0
2143	1511033103107731458	1.Corretivo 2.bolinha de gude 3.biscoito 4.tangerina 	0
1526	1511041890765975566	eu viro do um taoa na cara q desmaia esse fudido na hora 	1
600	1511114972499255296	luna ficou de castigo um tempão pq aprontou ai agora veio toda arrependida deitou no meu ombro e começou me lamber, a minha postura de brava vai embora de um jeito 	1
1798	1511029440817553408	Fizeram paredão falso na época errada 	0
1422	1511036181454151680	queria 	0
2533	1511119191537029124	mentira meu sobrinho tem mais condenação motora melhor que eu 	0
2423	1511118489603428352	47k de tweets falando várias bosta 	0
3895	1511115926665629696	Nossa recebi tanta mensagem que meu coração chega fica quentinho com o carinho de cada um❤️ 	1
2657	1511032586407235585	Desisto de tentar, cheguei ao ponto que percebi que sou uma merda😴💔✅ 	0
1038	1511120797926141957	Tankei foda nadinha parceiro 	0
783	1511034560947052548	vsf viado a mina achando ruim o tema de um seminário q aborda questões super importantes em relação a turismo sexual, hipersexualização de corpos brasileiros, prostituição e fetiches só pq ela n curte falar de sexo vsffffff vagabunda 	1
1268	1511041628168990725	eu não mereço um pai ariano e uma mãe escorpiana 	0
4327	1511116255180300294	Como eu consigo, na moral Q mulé bonita 	0
3167	1407757766119270000	se tu acredita que o cara deixa uma mulher ser humilhada na internet e usa uma criança pra esconder que é gay simplesmente pq ele quer (ele é milionário, tem dinheiro pra advogado caso realmente exista um contrato) e continua fã dessa pessoa tu é tão podre quanto ela	1
2494	1511121624514408451	Ninguém entende nada 😝😝 	0
2215	1511037684684406791	me revolta como as pessoas são chatas 	0
121	1511027714618269697	PESSOAL USEM CINTO DE SEGURANÇA SEMPRE. ENTROU NO CARRO, JÁ COLOCA! PELO AMOR. (Quando Lucas me buscou ele não tava usando, eu sempre reclamo pra colocar porque esquece. Imagina o que poderia ter rolado se ele estivesse sem?) 	1
778	1511121572165214209	eu realmente tô sem amigos kk 	0
984	1407462558139830000	que isso de fofoca gente todo dia virou festa	1
2899	1511114532235718656	até o fim, meu único amor 	1
3039	1407872976268180000	rsrs	0
2306	1511121512933298179	Eu tô urrando com essa amizade 🗣🗣 	0
